{
  "issue": 157,
  "human_owner": "TH3478",
  "objective": "Make wbcan saturation evidence race-safe, bounded, machine-readable, and independently validated.",
  "allowed_paths": [
    "kernel/wbcan/wbcan.c",
    "kernel/wbcan/test_state_concurrency.py",
    "kernel/wbcan/Makefile",
    "tests/unit/test_linux_driver_tests.py",
    "docs/task_packets/linux-wbcan-saturation-stats.json"
  ],
  "read_only_paths": [
    "AGENTS.md",
    ".github/workflows/ci.yml"
  ],
  "forbidden": [
    "interfaces/**",
    "firmware/**",
    "robot/control/**"
  ],
  "acceptance": [
    "all netdev statistic writers are serialized by one IRQ-safe writer lock around u64_stats_sync updates",
    "netdev statistics are exposed through ndo_get_stats64 with reader retry semantics",
    "RX backlog rejection increments rx_dropped instead of claiming rx_packets",
    "intentional drop-rx and allocation-failure paths remain observable in netdev statistics",
    "concurrent TX and stats sampling never observes a counter regression",
    "bounded concurrent producers use disjoint CAN IDs and deterministic sequence payloads",
    "normal saturation evidence reports per-producer sent, received, lost, duplicate, reordered, unexpected, and longest no-progress values",
    "the bounded stress entrypoint emits a versioned JSON report with environment, stage timing, and PASS or FAIL status",
    "malformed, incomplete, failed, or non-virtual stress reports fail validation",
    "the existing seven fault modes and state lifecycle behavior remain unchanged",
    "no physical CAN, MCU, actuator, or hard-real-time evidence is claimed"
  ],
  "commands": [
    "make -C kernel/wbcan",
    "make -C kernel/wbcan checkpatch",
    "sudo make -C kernel/wbcan reload",
    "sudo make -C kernel/wbcan test",
    "sudo make -C kernel/wbcan stress",
    "python -m pytest tests/unit/test_linux_driver_tests.py -v",
    "python tools/scripts/check_task_packet.py docs/task_packets/linux-wbcan-saturation-stats.json",
    "git diff --check origin/main...HEAD"
  ],
  "evidence": [
    "kernel build and checkpatch output",
    "privileged wbcan fault suite output",
    "concurrent netdev statistics sampling output",
    "per-producer bounded saturation accounting in the versioned JSON artifact",
    "marker-delimited dmesg without kernel warnings"
  ],
  "stop_conditions": [
    "the target kernel lacks u64_stats_sync or ndo_get_stats64",
    "a CAN core API change is required",
    "physical hardware evidence is required"
  ]
}
