{
  "issue": "139",
  "human_owner": "Quchaosheng",
  "objective": "Keep RTR byte accounting and bit-flip evidence aligned with actual CAN payload changes.",
  "allowed_paths": [
    "kernel/wbcan/wbcan.c",
    "kernel/wbcan/test_wbcan.sh",
    "docs/task_packets/linux-wbcan-rtr-accounting.json"
  ],
  "read_only_paths": ["firmware/**", "interfaces/**", "AGENTS.md"],
  "forbidden": ["robot/control/**", "firmware/**", "interfaces/**"],
  "acceptance": [
    "RTR frames contribute zero TX and RX payload bytes",
    "zero-length, short, and RTR frames cannot consume an ineligible bit-flip shot",
    "no-op bit flips do not increment injected evidence",
    "the next eligible full payload consumes and records the shot",
    "standard CAN payload helpers define byte accounting"
  ],
  "commands": [
    "make -C kernel/wbcan",
    "make -C kernel/wbcan checkpatch",
    "sudo make -C kernel/wbcan reload",
    "sudo make -C kernel/wbcan test"
  ],
  "evidence": ["module build output", "checkpatch output", "RTR and bit-flip runtime assertions"],
  "stop_conditions": [
    "CAN FD or CAN XL support is required",
    "firmware or interface changes are required",
    "physical bus timing must be modelled"
  ]
}
