{
  "issue": "95",
  "human_owner": "Quchaosheng",
  "objective": "Enforce event identity, run isolation and contiguous sequence integrity across append, replay and checkpoints.",
  "allowed_paths": [
    "libs/kernel/workbench/kernel/event_store.py",
    "libs/kernel/tests/test_k1_k10.py",
    "libs/kernel/tests/test_k1_k10_extended.py",
    "libs/kernel/README.md",
    "tests/unit/test_kernel_event_store.py",
    "docs/task_packets/kernel-event-store-checkpoints.json"
  ],
  "read_only_paths": [
    "AGENTS.md"
  ],
  "forbidden": [
    "robot/control/**",
    "firmware/**",
    "interfaces/**"
  ],
  "acceptance": [
    "a checkpoint created after reopening a log equals the persisted event count",
    "replay from the current checkpoint returns no historical events",
    "negative, boolean, and out-of-range checkpoints are rejected",
    "malformed and non-object log records fail closed",
    "default append rejects missing fields, duplicate event IDs, mixed runs, sequence gaps and unknown event types",
    "legacy object logs require an explicit migration-only constructor flag",
    "repository lint and tests pass"
  ],
  "commands": [
    "python libs/kernel/tests/test_k1_k10.py",
    "python -m pytest tests/unit/test_kernel_event_store.py -q",
    "python -m ruff check .",
    "python -m pytest tests/ -q"
  ],
  "evidence": [
    "restart checkpoint regression assertions",
    "corrupt-log failure assertions",
    "event-contract, identity, run and sequence regression assertions",
    "K1-K10 integration test output",
    "repository test output"
  ],
  "stop_conditions": [
    "event schema changes are required",
    "cross-process locking is required",
    "robot-control or firmware changes are required"
  ]
}
